{
  "schema_version": 1,
  "source": "topdeck.gg",
  "attribution": {
    "name": "TopDeck.gg",
    "url": "https://topdeck.gg"
  },
  "pulled_at": "2026-09-01T21:19:07.969765Z",
  "content_hash": "ffcf30ba96805007c4d7551de7623ceb6285a824923d6ef91b85f18789e8d057",
  "tid": "commander-705",
  "name": "Commander",
  "game": "Magic: The Gathering",
  "format": "EDH",
  "start_date_unix": 1787964000,
  "start_date_utc": "2026-08-29T00:40:00Z",
  "swiss_rounds": 1,
  "top_cut_size": 0,
  "event_data": {},
  "field_size": 16,
  "decklist_coverage": {
    "submitted": 0,
    "structured": 0,
    "total": 16
  },
  "entries": [
    {
      "standing": 1,
      "player_id": "s4FFCKrAHXYBXsPqKuvn",
      "player_name": "Baldwin\tDevin",
      "commanders": [],
      "wins": 0,
      "wins_swiss": 0,
      "wins_bracket": 0,
      "draws": 1,
      "losses": 0,
      "losses_swiss": 0,
      "losses_bracket": 0,
      "byes": 0,
      "top_cut": false,
      "winner": true,
      "decklist_present": false,
      "structured_deck_present": false
    },
    {
      "standing": 2,
      "player_id": "raPGaYhASCYzbp7Fn3U6",
      "player_name": "Bishop\tZachariah",
      "commanders": [],
      "wins": 0,
      "wins_swiss": 0,
      "wins_bracket": 0,
      "draws": 1,
      "losses": 0,
      "losses_swiss": 0,
      "losses_bracket": 0,
      "byes": 0,
      "top_cut": false,
      "winner": false,
      "decklist_present": false,
      "structured_deck_present": false
    },
    {
      "standing": 3,
      "player_id": "HrwfEiNKovPTc2OEWBU3",
      "player_name": "Jones\tShawn",
      "commanders": [],
      "wins": 0,
      "wins_swiss": 0,
      "wins_bracket": 0,
      "draws": 1,
      "losses": 0,
      "losses_swiss": 0,
      "losses_bracket": 0,
      "byes": 0,
      "top_cut": false,
      "winner": false,
      "decklist_present": false,
      "structured_deck_present": false
    },
    {
      "standing": 4,
      "player_id": "Rv9mAtOAPheQS8Jkkdpm",
      "player_name": "Lambert\tSteven",
      "commanders": [],
      "wins": 0,
      "wins_swiss": 0,
      "wins_bracket": 0,
      "draws": 1,
      "losses": 0,
      "losses_swiss": 0,
      "losses_bracket": 0,
      "byes": 0,
      "top_cut": false,
      "winner": false,
      "decklist_present": false,
      "structured_deck_present": false
    },
    {
      "standing": 5,
      "player_id": "PvCOAiO8JIuGT4mlOetI",
      "player_name": "Martin\tSam",
      "commanders": [],
      "wins": 0,
      "wins_swiss": 0,
      "wins_bracket": 0,
      "draws": 1,
      "losses": 0,
      "losses_swiss": 0,
      "losses_bracket": 0,
      "byes": 0,
      "top_cut": false,
      "winner": false,
      "decklist_present": false,
      "structured_deck_present": false
    },
    {
      "standing": 6,
      "player_id": "EjFHrzVndBIvHT5ddxHT",
      "player_name": "McDonald\tChristopher",
      "commanders": [],
      "wins": 0,
      "wins_swiss": 0,
      "wins_bracket": 0,
      "draws": 1,
      "losses": 0,
      "losses_swiss": 0,
      "losses_bracket": 0,
      "byes": 0,
      "top_cut": false,
      "winner": false,
      "decklist_present": false,
      "structured_deck_present": false
    },
    {
      "standing": 7,
      "player_id": "XHd4qBCK9rvjh55tumgE",
      "player_name": "McMurtrey\tJustin",
      "commanders": [],
      "wins": 0,
      "wins_swiss": 0,
      "wins_bracket": 0,
      "draws": 1,
      "losses": 0,
      "losses_swiss": 0,
      "losses_bracket": 0,
      "byes": 0,
      "top_cut": false,
      "winner": false,
      "decklist_present": false,
      "structured_deck_present": false
    },
    {
      "standing": 8,
      "player_id": "ZClndGGKatvNC6V49VjX",
      "player_name": "Meer\tMohammed",
      "commanders": [],
      "wins": 0,
      "wins_swiss": 0,
      "wins_bracket": 0,
      "draws": 1,
      "losses": 0,
      "losses_swiss": 0,
      "losses_bracket": 0,
      "byes": 0,
      "top_cut": false,
      "winner": false,
      "decklist_present": false,
      "structured_deck_present": false
    },
    {
      "standing": 9,
      "player_id": "rs6SOmN0J7zaACy2xSvB",
      "player_name": "Memisevic\tAnel",
      "commanders": [],
      "wins": 0,
      "wins_swiss": 0,
      "wins_bracket": 0,
      "draws": 1,
      "losses": 0,
      "losses_swiss": 0,
      "losses_bracket": 0,
      "byes": 0,
      "top_cut": false,
      "winner": false,
      "decklist_present": false,
      "structured_deck_present": false
    },
    {
      "standing": 10,
      "player_id": "VMmIYUbOKkQOqOJx6TQp",
      "player_name": "Renard\tKevin",
      "commanders": [],
      "wins": 0,
      "wins_swiss": 0,
      "wins_bracket": 0,
      "draws": 1,
      "losses": 0,
      "losses_swiss": 0,
      "losses_bracket": 0,
      "byes": 0,
      "top_cut": false,
      "winner": false,
      "decklist_present": false,
      "structured_deck_present": false
    },
    {
      "standing": 11,
      "player_id": "RZ8YVeoxoi7IN8xgpyo1",
      "player_name": "Ries\tGavin",
      "commanders": [],
      "wins": 0,
      "wins_swiss": 0,
      "wins_bracket": 0,
      "draws": 1,
      "losses": 0,
      "losses_swiss": 0,
      "losses_bracket": 0,
      "byes": 0,
      "top_cut": false,
      "winner": false,
      "decklist_present": false,
      "structured_deck_present": false
    },
    {
      "standing": 12,
      "player_id": "Aa1byBileKhrfF7L9bIO",
      "player_name": "Rinehart\tColin",
      "commanders": [],
      "wins": 0,
      "wins_swiss": 0,
      "wins_bracket": 0,
      "draws": 1,
      "losses": 0,
      "losses_swiss": 0,
      "losses_bracket": 0,
      "byes": 0,
      "top_cut": false,
      "winner": false,
      "decklist_present": false,
      "structured_deck_present": false
    },
    {
      "standing": 13,
      "player_id": "TF7pUbRWIK9VrpnukHWT",
      "player_name": "Taylor\tDonald",
      "commanders": [],
      "wins": 0,
      "wins_swiss": 0,
      "wins_bracket": 0,
      "draws": 1,
      "losses": 0,
      "losses_swiss": 0,
      "losses_bracket": 0,
      "byes": 0,
      "top_cut": false,
      "winner": false,
      "decklist_present": false,
      "structured_deck_present": false
    },
    {
      "standing": 14,
      "player_id": "6r0gwaopOvNoiu2KfS0x",
      "player_name": "Thurman\tGrant",
      "commanders": [],
      "wins": 0,
      "wins_swiss": 0,
      "wins_bracket": 0,
      "draws": 1,
      "losses": 0,
      "losses_swiss": 0,
      "losses_bracket": 0,
      "byes": 0,
      "top_cut": false,
      "winner": false,
      "decklist_present": false,
      "structured_deck_present": false
    },
    {
      "standing": 15,
      "player_id": "JVTtP4IdOExuKH8RCWUL",
      "player_name": "Waitsman\tJosh",
      "commanders": [],
      "wins": 0,
      "wins_swiss": 0,
      "wins_bracket": 0,
      "draws": 1,
      "losses": 0,
      "losses_swiss": 0,
      "losses_bracket": 0,
      "byes": 0,
      "top_cut": false,
      "winner": false,
      "decklist_present": false,
      "structured_deck_present": false
    },
    {
      "standing": 16,
      "player_id": "xJfOvrVlFI3UoqxGomlJ",
      "player_name": "a\tdevin",
      "commanders": [],
      "wins": 0,
      "wins_swiss": 0,
      "wins_bracket": 0,
      "draws": 1,
      "losses": 0,
      "losses_swiss": 0,
      "losses_bracket": 0,
      "byes": 0,
      "top_cut": false,
      "winner": false,
      "decklist_present": false,
      "structured_deck_present": false
    }
  ],
  "pods": [
    {
      "round": 1,
      "table": 1,
      "status": "Completed",
      "winner": "Draw",
      "winner_id": "Draw",
      "players": [
        {
          "id": "XHd4qBCK9rvjh55tumgE",
          "name": "McMurtrey\tJustin"
        },
        {
          "id": "xJfOvrVlFI3UoqxGomlJ",
          "name": "a\tdevin"
        },
        {
          "id": "rs6SOmN0J7zaACy2xSvB",
          "name": "Memisevic\tAnel"
        },
        {
          "id": "Rv9mAtOAPheQS8Jkkdpm",
          "name": "Lambert\tSteven"
        }
      ]
    },
    {
      "round": 1,
      "table": 2,
      "status": "Completed",
      "winner": "Draw",
      "winner_id": "Draw",
      "players": [
        {
          "id": "RZ8YVeoxoi7IN8xgpyo1",
          "name": "Ries\tGavin"
        },
        {
          "id": "6r0gwaopOvNoiu2KfS0x",
          "name": "Thurman\tGrant"
        },
        {
          "id": "PvCOAiO8JIuGT4mlOetI",
          "name": "Martin\tSam"
        },
        {
          "id": "VMmIYUbOKkQOqOJx6TQp",
          "name": "Renard\tKevin"
        }
      ]
    },
    {
      "round": 1,
      "table": 3,
      "status": "Completed",
      "winner": "Draw",
      "winner_id": "Draw",
      "players": [
        {
          "id": "s4FFCKrAHXYBXsPqKuvn",
          "name": "Baldwin\tDevin"
        },
        {
          "id": "HrwfEiNKovPTc2OEWBU3",
          "name": "Jones\tShawn"
        },
        {
          "id": "Aa1byBileKhrfF7L9bIO",
          "name": "Rinehart\tColin"
        },
        {
          "id": "raPGaYhASCYzbp7Fn3U6",
          "name": "Bishop\tZachariah"
        }
      ]
    },
    {
      "round": 1,
      "table": 4,
      "status": "Completed",
      "winner": "Draw",
      "winner_id": "Draw",
      "players": [
        {
          "id": "ZClndGGKatvNC6V49VjX",
          "name": "Meer\tMohammed"
        },
        {
          "id": "TF7pUbRWIK9VrpnukHWT",
          "name": "Taylor\tDonald"
        },
        {
          "id": "JVTtP4IdOExuKH8RCWUL",
          "name": "Waitsman\tJosh"
        },
        {
          "id": "EjFHrzVndBIvHT5ddxHT",
          "name": "McDonald\tChristopher"
        }
      ]
    }
  ]
}
